{
  "schema_version": 1,
  "mode": "hybrid",
  "target": "/private/tmp/claude-501/-Users-sukhob-opensource/ed547ec9-3380-41b5-9396-709ba7bd24d0/scratchpad/evals-r5/03-microservices-healthy",
  "profile": {
    "architecture": "microservices",
    "summary": "Order platform (v2): order-service takes customer orders over REST and orchestrates a place-order saga (reserve stock, then charge) with inventory-service and payment-service. Commands and replies go over Kafka through a transactional outbox and inbox in each service; payment-service calls an external PSP.",
    "stated_intent": "README: 3 replicas per service on k8s; peak ~300 orders/minute, expected to triple next year; failed messages retried ~3 minutes then dead-lettered to <topic>-dlt; every DLT record pages on-call; orders with no stock reply after 15 minutes are cancelled.",
    "assumptions": [
      "Mode is hybrid: there is code, and the README states scale and operational intent.",
      "Nobody was available to answer questions, so the review has no user-imposed scope limits.",
      "Infrastructure not in the repo (ingress or gateway, production Postgres sizing, Kafka cluster settings, alert rules) is assumed to exist as the README describes but is unverified; findings that depend on it are capped at medium confidence.",
      "The PSP's exact HTTP contract (which 4xx codes it returns for in-flight idempotency keys, rate limits and auth failures, and how long it keeps idempotency keys) is not in the repo; common PSP behaviour (Stripe-style) is assumed."
    ],
    "derived_load": [
      "~5 orders/s at today's peak (300/min), ~15 orders/s next year (900/min)",
      "~3 outbox rows per order in order-service (ReserveStock, ChargePayment, OrderConfirmed/Cancelled): ~15 rows/s today, ~45 rows/s next year",
      "~5-7 Kafka messages per order across the whole saga: ~35 msgs/s today, ~100 msgs/s next year"
    ],
    "stack": [
      "Java 17",
      "Spring Boot 3.3.4 (web, data-jpa, actuator, oauth2-resource-server)",
      "Spring Kafka",
      "Flyway",
      "PostgreSQL 16",
      "Kafka 3.7 (KRaft)",
      "ShedLock 5.16 (JDBC)",
      "Resilience4j (payment-service)",
      "Micrometer tracing with OTel bridge and OTLP exporter",
      "Micrometer Prometheus registry"
    ],
    "deployables": [
      "order-service (order-service/): REST /orders with JWT auth, saga orchestrator, saga watchdog; db=postgres orders; publishes inventory-commands, payment-commands, order-events; consumes inventory-events, payment-events",
      "inventory-service (inventory-service/): stock levels and reservations; db=postgres inventory; publishes inventory-events; consumes inventory-commands",
      "payment-service (payment-service/): payments and PSP capture over HTTPS (RestClient, 1s/3s timeouts, circuit breaker, retry); db=postgres payments; publishes payment-events; consumes payment-commands (concurrency 4)"
    ],
    "datastores": [
      "postgres: orders (used by order-service; also written by an external pricing back office via table price_list)",
      "postgres: inventory (used by inventory-service)",
      "postgres: payments (used by payment-service)",
      "All three databases live on one Postgres server in docker-compose; the production layout is not in the repo"
    ],
    "messaging": [
      "Kafka: inventory-commands, payment-commands, order-events (produced by order-service)",
      "Kafka: inventory-events (inventory-service), payment-events (payment-service)",
      "Kafka: <topic>-dlt for each topic; 12 partitions, replication factor 3; keyed by orderId; String JSON payloads with message-id and message-type headers"
    ],
    "key_flows": [
      "client -> order-service POST /orders (one tx: order row + outbox ReserveStock) -> inventory-commands -> inventory-service (reserve stock + outbox StockReserved/StockRejected) -> inventory-events -> order-service saga",
      "order-service saga (StockReserved) -> payment-commands -> payment-service -> PSP capture -> payment-events -> order-service (confirm, or cancel + ReleaseStock -> inventory-service)",
      "order-service SagaWatchdog: PENDING > 15 min -> cancel + ReleaseStock -> inventory-service"
    ],
    "background_work": [
      "OutboxRelay in each service: @Scheduled every 500 ms, ShedLock 'outbox-relay', batch 100",
      "Outbox purge (03:15) and inbox purge (03:45) nightly in each service, ShedLock",
      "SagaWatchdog in order-service: @Scheduled every 60 s, ShedLock 'saga-watchdog'",
      "DeadLetterMonitor in each service: Kafka listener on .*-dlt in its own consumer group",
      "Kafka listeners: order-service SagaReplyListener, inventory-service InventoryCommandListener, payment-service PaymentCommandListener (concurrency 4)"
    ],
    "runtime": "k8s Deployments with 3 replicas each, liveness and readiness on actuator probe groups, terminationGracePeriodSeconds 45, server.shutdown graceful; config from ConfigMap and Secret; no resource requests or limits, PDB or startupProbe; tracing at 10% sampling via OTLP; Prometheus scrape; gateway or ingress not in the repo.",
    "lenses_run": [
      "scalability",
      "persistence",
      "operability",
      "data-consistency",
      "resilience",
      "service-boundaries",
      "messaging"
    ]
  },
  "findings": [
    {
      "id": "DC-001",
      "lens": "data-consistency",
      "title": "Every PSP 4xx (including 401/403/408/409/429) is recorded as a final decline, so throttling, a bad API key or an in-flight retry cancels orders silently, and a capture can land on a cancelled order",
      "severity": "high",
      "confidence": "medium",
      "locations": [
        { "file": "payment-service/src/main/java/com/example/platform/payment/messaging/PaymentCommandListener.java", "line": 41 },
        { "file": "payment-service/src/main/java/com/example/platform/payment/psp/PspClient.java", "line": 46 },
        { "file": "payment-service/src/main/resources/application.yml", "line": 76 },
        { "file": "payment-service/src/main/resources/application.yml", "line": 86 },
        { "file": "order-service/src/main/java/com/example/platform/order/saga/OrderSaga.java", "line": 82 }
      ],
      "evidence": "PaymentCommandListener.java:41-44: `} catch (HttpClientErrorException rejected) { // A 4xx is the PSP's final answer (card declined, invalid request): fail the payment, don't retry. response = new PspClient.CaptureResponse(null, \"rejected_\" + rejected.getStatusCode().value()); }` then PaymentRecorder saves `Payment.Status.DECLINED` and publishes `PaymentFailed`. application.yml: both `circuitbreaker.instances.psp.ignore-exceptions` and `retry.instances.psp.ignore-exceptions` list `org.springframework.web.client.HttpClientErrorException`. PspClient retries with the same `Idempotency-Key` (`\"capture-\" + command.orderId()`) after a 3s read timeout.",
      "failure_scenario": "(a) The PSP API key in payment-service-secrets expires or is rotated out of order (401/403), or the PSP rate-limits as traffic triples (429). Every ChargePayment gets a 4xx; Resilience4j neither retries it nor counts it, so the breaker stays closed. The listener records DECLINED and emits PaymentFailed; order-service cancels the order and releases the stock. Nothing throws, so nothing reaches `<topic>-dlt` and the README's only page never fires: every order in the window is silently cancelled, and the unique `payments.order_id` row blocks a later redrive. (b) A capture exceeds the 3s read timeout while the PSP is still processing it; the Resilience4j retry with the same key gets 409 (in-flight idempotency key, Stripe-style). It is recorded as declined and the order is cancelled, then the original capture completes at the PSP: the customer is charged for a cancelled order, and no message or record ever says so.",
      "recommendation": "Classify PSP 4xx responses in PspClient instead of treating the exception type as the business outcome. Map only definitive declines (402, or the PSP's decline codes) to PaymentFailed. Throw a transient exception for 408/409/425/429 so the Resilience4j retry and the Kafka backoff retry them (honouring Retry-After) and the circuit breaker counts them. Throw a non-retryable configuration exception for 401/403 so the command dead-letters and pages. Narrow both `ignore-exceptions` lists to the decline class. As a backstop for unknown outcomes, query the PSP by idempotency key before recording a decline, and alert (or issue a refund command) when the PSP reports a capture for an order that is CANCELLED.",
      "pattern": "compensating-action",
      "applies_when": "payment-service drives the saga's compensation path from the PSP's HTTP status, retries captures with the same idempotency key under a 3s read timeout, and the README relies on the DLT page as the failure signal; money is involved on every order.",
      "effort": "small",
      "also_reported_by": ["resilience"]
    },
    {
      "id": "DC-002",
      "lens": "data-consistency",
      "title": "No payment-attempt row is written before the PSP call, so a `ChargePayment` redriven from the DLT after the PSP's idempotency window can capture twice",
      "severity": "medium",
      "confidence": "medium",
      "locations": [
        { "file": "payment-service/src/main/java/com/example/platform/payment/messaging/PaymentCommandListener.java", "line": 40 },
        { "file": "payment-service/src/main/java/com/example/platform/payment/messaging/PaymentRecorder.java", "line": 30 },
        { "file": "payment-service/src/main/java/com/example/platform/payment/messaging/DeadLetterMonitor.java", "line": 17 }
      ],